after travel, project\\prog3-ui\\data\\s1-i1.txt
what can travelers do to prevent hiv, project\\prog3-ui\\data\\s1-i2.txt
what is hiv, project\\prog3-ui\\data\\s1-i3.txt
who is at risk, project\\prog3-ui\\data\\s1-i4.txt
best ways to treat hiv symptoms, project\\prog3-ui\\data\\s2-i1.txt
effects of antiretroviral drugs on the body, project\\prog3-ui\\data\\s2-i2.txt
hiv effects on the circulatory system, project\\prog3-ui\\data\\s2-i3.txt
hiv effects on the digestive system, project\\prog3-ui\\data\\s2-i4.txt
hiv effects on the eyes, project\\prog3-ui\\data\\s2-i5.txt
hiv effects on the immune system, project\\prog3-ui\\data\\s2-i6.txt
hiv effects on the kidneys, project\\prog3-ui\\data\\s2-i7.txt
hiv effects on the nervous system, project\\prog3-ui\\data\\s2-i8.txt
hiv effects on the skeletal system, project\\prog3-ui\\data\\s2-i9.txt
hiv effects on the skin, project\\prog3-ui\\data\\s2-i10.txt
how can you prevent an hiv infection, project\\prog3-ui\\data\\s2-i11.txt
how do you catch hiv, project\\prog3-ui\\data\\s2-i12.txt
living with hiv and aids, project\\prog3-ui\\data\\s2-i13.txt
stages of an hiv infection, project\\prog3-ui\\data\\s2-i14.txt
types and strains of hiv, project\\prog3-ui\\data\\s2-i15.txt
what are the symptoms of hiv, project\\prog3-ui\\data\\s2-i16.txt
what is hiv testing, project\\prog3-ui\\data\\s2-i17.txt
what is hiv, project\\prog3-ui\\data\\s2-i18.txt
what puts you at risk for hiv, project\\prog3-ui\\data\\s2-i19.txt
where is hiv widespread, project\\prog3-ui\\data\\s2-i20.txt
who gets hiv, project\\prog3-ui\\data\\s2-i21.txt